<?xml version="1.1" encoding="UTF-8"?>
<!--
 Copyright 2010 Torkjel Hongve (torkjelh@conduct.no)

 This file is part of Upside.

 Upside is free software: you can redistribute it and/or modify
 it under the terms of the GNU General Public License as published by
 the Free Software Foundation, either version 3 of the License, or
 (at your option) any later version.

 Upside is distributed in the hope that it will be useful,
 but WITHOUT ANY WARRANTY; without even the implied warranty of
 MERCHANTABILITY or FITNESS FOR A PARTICULAR PURPOSE.  See the
 GNU General Public License for more details.

 You should have received a copy of the GNU General Public License
 along with Upside.  If not, see <http://www.gnu.org/licenses/>.
-->
<!DOCTYPE upside SYSTEM "upside-conf.dtd">

<upside base-url="http://upside.example.com/">

  <site name="foo" url="http://foo.example.com/site/"/>
  <site name="bar" url="http://bar.example.com/update-site/"/>

  <federated-site name="main">
    <description>Main site</description>

    <category name="cat-foo">
      <description>Foo stuff</description>
      <include site="foo"/>
      <include site="foo" category="zooc"/>
      <include site="foo" feature="zoof"/>
      <include site="foo" feature="zoofv" version="2.0"/>
    </category>

    <category name="cat-bar">
      <include site="bar"/>
    </category>

    <include site="foo" keep-categories="true"/>
    <include site="bar" category="barc"/>
    <include site="foo" feature="foo" version="1.0"/>

  </federated-site>

  <federated-site name="test">
    <category name="test">
        <description>Test category</description>
        <include site="foo"/>
    </category>
  </federated-site>

</upside>
