<?xml version="1.1" encoding="UTF-8"?>
<!--
 Copyright 2010 Torkjel Hongve (torkjelh@conduct.no)

 This file is part of Upside.

 Upside is free software: you can redistribute it and/or modify
 it under the terms of the GNU General Public License as published by
 the Free Software Foundation, either version 3 of the License, or
 (at your option) any later version.

 Upside is distributed in the hope that it will be useful,
 but WITHOUT ANY WARRANTY; without even the implied warranty of
 MERCHANTABILITY or FITNESS FOR A PARTICULAR PURPOSE.  See the
 GNU General Public License for more details.

 You should have received a copy of the GNU General Public License
 along with Upside.  If not, see <http://www.gnu.org/licenses/>.
-->
<!DOCTYPE upside SYSTEM "upside-conf.dtd">

<upside base-url="http://upside.example.com/">

  <site name="site1" url="http://foo/site1"/>
  <site name="site2" url="http://foo/site2"/>

  <federated-site name="merged">
    <description>Merged site</description>

    <include site="site1" keep-categories="true"/>

    <include site="site2"/>

    <category name="lion">
        <include site="site1" category="mouse"/>
        <include site="site2" feature="feature2b" keep-categories="true"/>
    </category>

  </federated-site>

</upside>
